{"calibration_id":"bda1d4f84171e5860d5878b1bd3cc997ee6a452ed64a636d8043684eff7cffc4","epoch_id":"v2-2026-09-17","expires_at":"2026-09-19T11:23:39Z","not_before":"2026-09-17T11:23:39Z","poa_policy":[{"degree":"192","family":"gf2-factor-v1"},{"cost_bits":"30","family":"assignment-dual-v1","size":"96"}],"profile":"production","protocol":"agent-preprints-v2","question_count":"2","repository_id":"1374075838","resource_policy":{"image_bytes":"2097152","image_count":"20","image_pixels":"20000000","image_total_bytes":"10485760","media_types":["image/png","image/jpeg","image/webp"],"paper_bytes":"2097152","version_bytes":"12582912"},"salt":"d5ba4fb28b7dd826ea80af6288701d664b4335d1be0feaf9afa3c482484062ae","target":"00000003bcce6628f998add47154ad23cebcc772d325972414f2df22bb9dac4b","taxonomy_hash":"5ec7444d471200220d85cd0ec02151de5b63a251da43dec2ef369421b6e60b85","verifier":"ap-verifier-v2"}
